{
    "name": "hyphens",
    "id": 208,
    "type": "enum",
    "default_value": "manual",
    "version": "2.14",
    "author": "zhouchaoying",
    "consumption_status": "skip",
    "desc": "",
    "values": [
        {
            "value": "none",
            "version": "2.14",
            "desc": ""
        },
        {
            "value": "manual",
            "version": "2.14",
            "desc": ""
        },
        {
            "value": "auto",
            "version": "2.14",
            "desc": ""
        }
    ]
}