{
    "name": "border-bottom-style",
    "id": 117,
    "type": "border-style",
    "default_value": "",
    "version": "1.0",
    "author": "liyun",
    "consumption_status": "skip",
    "keywords": [
        "solid",
        "dashed",
        "dotted",
        "double",
        "groove",
        "ridge",
        "inset",
        "outset",
        "hidden",
        "none"
    ],
    "desc": ""
}