{
    "name": "animation-fill-mode",
    "id": 70,
    "type": "complex",
    "default_value": "none",
    "version": "1.0",
    "desc": "",
    "author": "liyanbo, linxiaosong",
    "consumption_status": "skip",
    "values": [
        {
            "value": "none",
            "version": "1.0",
            "desc": ""
        },
        {
            "value": "forwards",
            "version": "1.0",
            "desc": ""
        },
        {
            "value": "backwards",
            "version": "1.0",
            "desc": ""
        },
        {
            "value": "both",
            "version": "1.0",
            "desc": ""
        }
    ]
}