{
    "name": "perspective",
    "id": 189,
    "type": "length",
    "default_value": "none",
    "version": "2.1",
    "author": "wujintian",
    "consumption_status": "layout-wanted",
    "desc": "",
    "values": [
        {
            "value": "number",
            "version": "2.1",
            "desc": ""
        },
        {
            "value": "vw",
            "version": "2.1",
            "desc": ""
        },
        {
            "value": "vh",
            "version": "2.1",
            "desc": ""
        },
        {
            "value": "default",
            "version": "2.1",
            "desc": ""
        },
        {
            "value": "px",
            "version": "2.1",
            "desc": ""
        }
    ]
}